Company Name,Industry,Location,Revenue,Stage,Description,Founded,Employees
Acme Analytics,Software,San Francisco,5M,Series A,AI-powered analytics platform for enterprise data,2020,25
TechStart Solutions,SaaS,New York,2M,Seed,Cloud-based collaboration tools for remote teams,2021,12
DataFlow Systems,Data,Austin,10M,Series B,Real-time data processing and visualization,2019,45
CloudVenture Inc,Cloud,Seattle,7M,Series A,Multi-cloud management and optimization,2020,30
SecureNet Tech,Cybersecurity,Boston,15M,Series C,Next-gen network security solutions,2018,75
HealthTech Pro,Healthcare,Chicago,3M,Seed,Digital health monitoring platform,2022,15
FinServe AI,FinTech,London,12M,Series B,AI-driven financial services automation,2019,50
EduLearn,EdTech,San Diego,4M,Series A,Adaptive learning platform for K-12,2020,28
GreenEnergy Co,CleanTech,Denver,8M,Series A,Renewable energy management software,2021,35
RetailPro,Retail Tech,Miami,6M,Series A,Smart inventory and POS system,2020,22
